,Descripción,Link
0,mujer reuniendo agua junto al río. actividades pesqueras en la granja. entorno rural.,https://www.shutterstock.com/image-photo/woman-gathering-water-by-river-600nw-1777569290.jpg
1,"un hombre indígena de la etnia dessana tocando instrumentos de viento y su rostro pintado con elementos de su cultura. ciudad de manaos, estado de amazonas, brasil, 10 de octubre de 2024.",https://www.shutterstock.com/image-photo/indigenous-man-dessana-ethnic-group-600nw-2528701937.jpg
2,"orinoco, venezuela - 11-23-2021: niños indígenas orinoco nativos nadando en canoa de madera tradicional",https://www.shutterstock.com/image-photo/orinoco-venezuela-11232021-native-indigenous-600nw-2105316656.jpg
3,"retrato al aire libre de india nativa americana, retrato de hembra chamánica con sombrero de pluma indio y maquillaje colorido",https://www.shutterstock.com/image-photo/native-american-indian-woman-portrait-600nw-1741280753.jpg
4,"mujer vestida con un vestido marrón y puesta la cabeza con plumas de pájaros, pie desnudo, levanta hoja verde táctil, retrato de maqueta posando. luz borrosa alrededor",https://www.shutterstock.com/image-photo/woman-wearing-brown-dress-put-600nw-1660623823.jpg
5,"retrato emocional joven guerrera hermosa mujer en ropa amazónica o guerrero medieval con ramo de flores en lugar de armas cerca de cerezo árbol de flor en jardín de primavera, paisaje pintoresco",https://www.shutterstock.com/image-photo/emotional-portrait-young-beautiful-warrior-600nw-2439452267.jpg
6,"orinoco, venezuela - 11-23-2021: hombre nativo de orinoco tribal cosechando comida de la palmera en la jungla",https://www.shutterstock.com/image-photo/orinoco-venezuela-11232021-native-tribal-600nw-2105316644.jpg
