,Descripción,Link
0,hermosa mujer chamánica con calavera de cabeza y ciervo.,https://www.shutterstock.com/image-photo/beautiful-shamanic-woman-headdress-deer-600nw-2017709852.jpg
1,"yogyakarta, indonesia, 26 de febrero de 2023, cinco niños y niñas jugando a orillas del río",https://www.shutterstock.com/image-photo/yogyakartaindonesiafebruary-26-2023five-boys-girls-600nw-2270298213.jpg
2,"la bella mujer que se levanta con vestido marrón y pone la cabeza en la cabeza con plumas de pájaros, fondo verde del bosque, retrato de maqueta posando, luz borrosa alrededor",https://www.shutterstock.com/image-photo/beautiful-woman-raising-wearing-brown-600nw-1660623007.jpg
3,"en verano, en un día soleado en el bosque, una niña pequeña.",https://www.shutterstock.com/image-photo/summer-on-bright-sunny-day-600nw-1932981182.jpg
4,"
bella joven peruana de la cultura yanesha posando con vestidos, joyas, maquillaje, ropa y accesorios diseñados con iconografía asháninka en la naturaleza",https://www.shutterstock.com/image-photo/beautiful-young-peruvian-woman-yanesha-600nw-2335635835.jpg
5,"hombre indígena brasileño del grupo étnico pataxó retrato celebrando el día internacional de los pueblos indígenas con canciones tradicionales y bailes con disfraces típicos - río de janeiro, brasil 08.12.2023",https://www.shutterstock.com/image-photo/brazilian-indigenous-man-ethnic-group-600nw-2352637405.jpg
