,Descripción,Link
0,"pebas, perú - sep 2017: mujer local vendiendo comida y hombre caucásico con cámara fotográfica en el ferry de santa rosa a iquitos en la amazonía, amazonía, sudamérica. cuenca del río amazonas.",https://www.shutterstock.com/image-photo/pebas-peru-sep-2017-local-600nw-2295744793.jpg
1,"kalimantan, indonesia - 20 de noviembre de 2023: retrato de una mujer modelo, con el estilo de una antigua tribu india, con un fondo oscuro.",https://www.shutterstock.com/image-photo/kalimantan-indonesia-november-20-2023-600nw-2395192173.jpg
2,"un chamán de la tribu dessana en las afueras de la ciudad de manaos recibiendo visitantes tocando un instrumento de percusión. ciudad de manaos, estado de amazonas, brasil, 26 de septiembre de 2024.",https://www.shutterstock.com/image-photo/shaman-dessana-tribe-on-outskirts-600nw-2522459153.jpg
3,"alalapadu, surinam - 18 de noviembre de 2016: niños indígenas vestidos con uniformes escolares se sientan a la mesa en una pequeña escuela de una aldea indígena en la selva amazónica.",https://www.shutterstock.com/image-photo/alalapadu-suriname-november-18-2016-600nw-2476781265.jpg
4,"retrato al aire libre de india nativa americana, retrato de hembra chamánica con sombrero de pluma indio y maquillaje colorido",https://www.shutterstock.com/image-photo/native-american-indian-woman-portrait-600nw-1741280672.jpg
5,atractiva mujer joven en joyas étnicas con tambor. retrato de cerca. ,https://www.shutterstock.com/image-photo/attractive-young-woman-ethnic-jewelry-600nw-427592950.jpg
6,"cuenca, ecuador - 25 de marzo de 2023: feria de artesanías de la provincia de pastaza. una mujer amazónica quechua (kichwa) con el pelo largo representa un collar artesanal local de cuentas hechas a mano.",https://www.shutterstock.com/image-photo/cuenca-ecuador-march-25-2023-600nw-2310397285.jpg
7,"joven guerrera hermosa mujer vestida con ropa amazónica o guerrera medieval con ramo de flores en lugar de armas cerca del árbol de flores de cerezo en el jardín de primavera, paisaje pintoresco",https://www.shutterstock.com/image-photo/young-beautiful-warrior-girl-woman-600nw-2203361509.jpg
8,"vista alegre, amazonía, perú - 14 de septiembre de 2024 vista de una niña que pasea en bicicleta por su casa en un pueblo amazónico.",https://www.shutterstock.com/image-photo/vista-alegre-amazon-peru-september-600nw-2529040639.jpg
