,Descripción,Link
0,"retrato al aire libre de india nativa americana, retrato de hembra chamánica con sombrero de pluma indio y maquillaje colorido",https://www.shutterstock.com/image-photo/native-american-indian-woman-portrait-600nw-1741280636.jpg
1,"joven guerrera hermosa mujer vestida con ropa amazónica o guerrera medieval con ramo de flores en lugar de armas cerca del árbol de flores de cerezo en el jardín de primavera, paisaje pintoresco",https://www.shutterstock.com/image-photo/young-beautiful-warrior-girl-woman-600nw-2204599029.jpg
2,jovencita y hermosa mujer silvestre rezando,https://www.shutterstock.com/image-photo/beatiful-young-wild-woman-praying-600nw-606718223.jpg
3,joven atractiva en jefatura. retrato blanco y negro. estilo indio,https://www.shutterstock.com/image-photo/attractive-young-woman-chieftain-black-600nw-419545819.jpg
4,"un grupo de cinco hombres indígenas del grupo étnico desana o tukuya siendo fotografiados a orillas de un río en su comunidad. ciudad de manaus, brasil 20 de junio de 2024",https://www.shutterstock.com/image-photo/group-five-indigenous-men-desana-600nw-2478922613.jpg
5,mujer frente a casas con techo de paja en el pueblo de puyanawa,https://www.shutterstock.com/image-photo/woman-front-thatched-houses-puyanawa-600nw-2397820045.jpg
6,"retratos de mujeres jóvenes con patrones tribales que cubren su cuerpo, salvaje y hermoso, mar, arena, negro",https://www.shutterstock.com/image-photo/portraits-young-woman-tribal-patterns-600nw-1813346905.jpg
7,mujer nativa norteamericana sosteniendo la proa y la flecha posando en la naturaleza. estilo de vida,https://www.shutterstock.com/image-photo/native-american-female-holding-bow-600nw-2010369311.jpg
