,Descripción,Link
0,retrato de niña turista asiática en la selva amazónica en el perú. la foto fue tomada en septiembre de 2024.,https://www.shutterstock.com/image-photo/asian-girl-tourist-portrait-amazon-600nw-2529035013.jpg
1,retrato de una mujer misteriosa viciando arte corporal preparar poción rezar luces azul anaranjado aisladas en un fondo oscuro,https://www.shutterstock.com/image-photo/portrait-mysterious-woman-viking-body-600nw-2336569055.jpg
2,"alalapadu, surinam - 18 de noviembre de 2016: retrato de un perfil de una mujer indígena en un pueblo indígena en la selva amazónica surinamesa",https://www.shutterstock.com/image-photo/alalapadu-suriname-november-18th-2016-600nw-2471997535.jpg
3,retrato de niña turista asiática en la selva amazónica en el perú. la foto fue tomada en septiembre de 2024.,https://www.shutterstock.com/image-photo/asian-girl-tourist-portrait-amazon-600nw-2529035015.jpg
4,"
bella joven peruana de la cultura yanesha posando con vestidos, joyas, maquillaje, ropa y accesorios diseñados con iconografía asháninka en la naturaleza",https://www.shutterstock.com/image-photo/beautiful-young-peruvian-woman-yanesha-600nw-2335635785.jpg
5,retrato de niña turista asiática en la selva amazónica en el perú. la foto fue tomada en septiembre de 2024.,https://www.shutterstock.com/image-photo/asian-girl-tourist-portrait-amazon-600nw-2529035017.jpg
6,"delgados pilares de acacia joven, contra el telón de fondo de hojas verdes gruesas en el bosque, durante la puesta del sol, disparado en un gran ángulo",https://www.shutterstock.com/image-photo/thin-pillars-young-acacia-against-600nw-2508945813.jpg
7,"alalapadu, surinam - 17 de noviembre de 2016: una mujer indígena cocina mandioca en una sartén en un incendio de leña en un pueblo indígena en la selva amazónica surinamesa.",https://www.shutterstock.com/image-photo/alalapadu-suriname-november-17th-2016-600nw-2472418643.jpg
8,retrato de una mujer chamán africana.,https://www.shutterstock.com/image-photo/portrait-african-shaman-woman-600nw-754620073.jpg
