,Descripción,Link
0,"retrato de una joven con un perro malamute de alaska en el bosque contra el fondo de la naturaleza
",https://www.shutterstock.com/image-photo/portrait-young-woman-alaskan-malamute-600nw-1842752737.jpg
1,"mujer amazónica con espada, mito escandinavo, mujer guerrera, baile",https://www.shutterstock.com/image-photo/amazon-woman-sword-scandinavian-myth-600nw-2296390265.jpg
2,"joven guerrera hermosa mujer vestida con ropa amazónica o guerrera medieval con ramo de flores en lugar de armas cerca del árbol de flores de cerezo en el jardín de primavera, paisaje pintoresco",https://www.shutterstock.com/image-photo/young-beautiful-warrior-girl-woman-600nw-2204595719.jpg
3,mujer sexy y salvaje aislada de fondo blanco,https://www.shutterstock.com/image-photo/sexy-wild-woman-isolated-on-600nw-11167675.jpg
4,"bangalore, india, 22 de abril de 2023:  una joven india satisfecha pidió comestibles en línea. revisión de los artículos entregados.  compras mensuales de comestibles. concepto de compra a distancia, servicio de entrega a domicilio.",https://www.shutterstock.com/image-photo/bangalore-india-22nd-april-2023-600nw-2292228345.jpg
5,"sambas, indonesia - 6 de agosto de 2024: carnaval de ropa tejida de sambas al que asistieron varios grupos, desde niños hasta adultos, llevando ropa única e interesante",https://www.shutterstock.com/image-photo/sambas-indonesia-august-6-2024-600nw-2498871949.jpg
6,"pebas, perú - 12 de diciembre de 2017: niños peruanos - habitantes de la selva amazónica jugando en un puerto a orillas de la amazonía amazónica, américa del sur.",https://www.shutterstock.com/image-photo/pebas-peru-dec-12-2017-600nw-2478523267.jpg
7,"joven guerrera hermosa mujer vestida con ropa amazónica o guerrera medieval con ramo de flores en lugar de armas cerca del árbol de flores de cerezo en el jardín de primavera, paisaje pintoresco",https://www.shutterstock.com/image-photo/young-beautiful-warrior-girl-woman-600nw-2213311597.jpg
