,Descripción,Link
0,hombre sonriente sentado en una roca en el río,https://www.shutterstock.com/image-photo/lifestyle-smiling-man-sitting-on-600nw-2455672051.jpg
1,"retrato de una joven encantadora mujer con un perro malamute de alaska en el bosque contra el fondo de la naturaleza",https://www.shutterstock.com/image-photo/portrait-young-charming-woman-alaskan-600nw-1851802063.jpg
2,un joven amazón con un arco en la selva tropical,https://www.shutterstock.com/image-photo/young-amazon-bow-rainforest-600nw-1718617966.jpg
3,"sambas, indonesia - 6 de agosto de 2024: carnaval de ropa tejida de sambas al que asistieron varios grupos, desde niños hasta adultos, llevando ropa única e interesante",https://www.shutterstock.com/image-photo/sambas-indonesia-august-6-2024-600nw-2498871937.jpg
4,"cuenca, ecuador - 3 de noviembre de 2022: feria de artesanía de la provincia de pastaza. dos mujeres indígenas de nacionalidad huaorani (waorani) con ropa típica y pintura facial representan la artesanía hecha de fibra de palma.",https://www.shutterstock.com/image-photo/cuencaecuador-november-3-2022-craft-600nw-2503462679.jpg
