,Descripción,Link
0,petroglifos de más de 5000 años de antigüedad en las cuevas de werephai en la selva tropical del sur de surinam,https://www.shutterstock.com/image-photo/more-than-5000-year-old-600nw-2480027905.jpg
1,view of the amazon area and an indigenous community.,https://www.shutterstock.com/image-photo/view-amazon-area-indigenous-community-600nw-1481176997.jpg
2,"achiote (bixa orellana) is a large shrub or small tree produces spiny red fruits popularly called ""urucum"" has been used by native communities in brazil",https://www.shutterstock.com/image-photo/achiote-bixa-orellana-large-shrub-600nw-1554868628.jpg
3,emotional brunette girl with long hair in the amazon costume with bow and arrow on a white background.,https://www.shutterstock.com/image-photo/emotional-brunette-girl-long-hair-600nw-494129362.jpg
4,poison dart frog or poison arrow frogs is the common name of a group of frogs in the family dendrobatidae which are native to tropical central and south america,https://www.shutterstock.com/image-photo/poison-dart-frog-arrow-frogs-600nw-1204308538.jpg
5,"amazonia, peru - nov 10, 2010: unidentified amazonian indigenous two women laugh.indigenous people of amazonia are protected bycoica (coordinator of indigenous organizations of the amazon river basin)",https://www.shutterstock.com/image-photo/amazonia-peru-nov-10-2010-600nw-224533405.jpg
6,"sao paulo sp brasil 22 de septiembre de 2024 manifestantes marchan por la justicia climática y contra los incendios forestales que afectan a todo el país en sao paulo, brasil, el 22 de septiembre de 2024",https://www.shutterstock.com/image-photo/sao-paulo-sp-brazil-september-600nw-2520643377.jpg
7,"kumamoto, japan - oct 3 2020 : the apps of popular e-commerce companies in india (flipkart, amazon, paytm mall, myntra, snapdeal, indiamart, firstcry and big basket) on iphone screen.",https://www.shutterstock.com/image-photo/kumamoto-japan-oct-3-2020-600nw-1871672599.jpg
8,perico periquito amarillo mirando a la cámara,https://www.shutterstock.com/image-photo/yellow-budgie-parakeet-looking-camera-600nw-2488291501.jpg
9,woman athlete gymnast in the form of an elf performs acrobatics on a black background in the scenic red and blue light.,https://www.shutterstock.com/image-photo/woman-athlete-gymnast-form-elf-600nw-580950607.jpg
10,amazon river and rainforest landscape. peru. south america.,https://www.shutterstock.com/image-photo/amazon-river-rainforest-landscape-peru-600nw-1184116360.jpg
11,"rice with coconut, yellow flour and  dried meat with rice in an old copper pot - traditional bahia food",https://www.shutterstock.com/image-photo/rice-coconut-yellow-flour-dried-600nw-617424617.jpg
12,açaí bosque palma río amazonas manglar isla de marajó salvaterra biodiversidad fauna flora naturaleza ecoturismo paisaje rural comunidad vegetación indígena navegación costera barcos drone,https://www.shutterstock.com/image-photo/forest-palm-amazon-river-mangrove-600nw-2484128931.jpg
13,joven disfrazada de indio americano ,https://www.shutterstock.com/image-photo/young-woman-costume-american-indian-600nw-275261537.jpg
14,sparta tus alas y vuela.,https://www.shutterstock.com/image-photo/spread-your-wings-fly-600nw-2375620311.jpg
15,"amazon river, peru - dec 03, 2018: life style. local woman selling fruit (guama, guaba, pepeto, paterna or inga) on the ferry from santa rosa to iquitos. amazonia, south america. basin of amazon river",https://www.shutterstock.com/image-photo/amazon-river-peru-dec-03-600nw-1700062132.jpg
16,woman athlete in the amazon costume posing on a black background in the scenic red and blue light.,https://www.shutterstock.com/image-photo/woman-athlete-amazon-costume-posing-600nw-580941496.jpg
17,"natural medinal products to cure diseases, from the community of yaneshas, oxapampa. october 28, 2019, peru.",https://www.shutterstock.com/image-photo/natural-medinal-products-cure-diseases-600nw-1557584417.jpg
18,"frutos de camu camu maduros (myrciaria dubia), frescos y parcialmente cortados de forma transversal. esta es una fruta rara en la selva amazónica, que es saludable y tiene la mayor concentración de vitamina c natural.",https://www.shutterstock.com/image-photo/ripe-camu-fruits-myrciaria-dubia-600nw-2435171725.jpg
19,small amazonian village in late afternoon sunshine after the storm,https://www.shutterstock.com/image-photo/small-amazonian-village-late-afternoon-600nw-689026156.jpg
20,"porto seguro, bahia, brasil - 1 de agosto de 2023: indios de etina pataxo vistos durante el festival aragwaka en el pueblo de jaqueira en la ciudad de porto seguro.",https://www.shutterstock.com/image-photo/porto-seguro-bahia-brazil-august-600nw-2342472083.jpg
21,"jaguar is a cat, a feline in the panthera genus only extant panthera species native to the americas. jaguar is the third-largest feline after the tiger and lion, and the largest in the americas.",https://www.shutterstock.com/image-photo/jaguar-cat-feline-panthera-genus-600nw-1223152342.jpg
22,"tabatinga, brazil - september 2017: portrait of a boys - an inhabitant of the amazon rainforest at the sunday fiesta. amazonia, latin america.",https://www.shutterstock.com/image-photo/tabatinga-brazil-september-2017-portrait-600nw-1952450494.jpg
23,"selva, brazil- sep, 2017: caucasian man on the beach in amazon rainforest during the low water season. amazonian jungle - green lungs of the world. brazil. peru. colombia, amazonia. south america.",https://www.shutterstock.com/image-photo/selva-brazil-sep-2017-caucasian-600nw-1962272122.jpg
24,"goddess of fertility,ancient maya indians,halloween",https://www.shutterstock.com/image-photo/goddess-fertilityancient-maya-indianshalloween-600nw-323048813.jpg
25,"indios brasileños del grupo étnico pataxó durante sus actividades diarias de danza, caza y pesca",https://www.shutterstock.com/image-photo/brazilian-indians-ethnic-group-during-600nw-1373681489.jpg
26,"el asfalto cálido, que serpentea amor, también es su peligro. la serpiente bothrops bilineatusi que ha sido asesinada por un auto. una especie venenosa de viper nativa de amazon. carretera federal br 320, amazonas, brasil.",https://www.shutterstock.com/image-photo/warm-asphalt-which-snakes-love-600nw-2255475541.jpg
27,"amazon river / peru - 12 may 2011: indian village on amazon river, peru, south america",https://www.shutterstock.com/image-photo/amazon-river-peru-12-may-600nw-1679224939.jpg
28,"new delhi, india, 2020. safal store employee wearing mask and paytm qr code displayed to encourage people to pay via contactless methods to prevent corona virus (covid-19) disease pandamic spread ",https://www.shutterstock.com/image-photo/new-delhi-india-2020-safal-600nw-1708301047.jpg
29,"joven latinoamericana sonriendo en el río san salvador en palomino, colombia",https://www.shutterstock.com/image-photo/young-latin-woman-smiling-san-600nw-1993050518.jpg
30,"
bella joven peruana de la cultura yanesha posando con vestidos, joyas, maquillaje, ropa y accesorios diseñados con iconografía asháninka en la naturaleza",https://www.shutterstock.com/image-photo/beautiful-young-peruvian-woman-yanesha-600nw-2335635825.jpg
31,hombre espiritual superior en la naturaleza ,https://www.shutterstock.com/image-photo/spiritual-senior-man-nature-600nw-2465984123.jpg
32,"jaguar, panthera onca, es una gran especie felid y el único miembro existente del género panthera nativo de las américas, jaguar acosando a través de la vegetación en el río cuiaba en el pantanal, brasil",https://www.shutterstock.com/image-photo/jaguar-panthera-onca-large-felid-600nw-1889700994.jpg
33,"closeup of sun parakeet or sun conure aratinga solstitialis, bird. it is a medium-sized, vibrantly colored parrot native to northeastern south america.",https://www.shutterstock.com/image-photo/closeup-sun-parakeet-conure-aratinga-600nw-1327405376.jpg
34,hamacas tradicionales para la sociedad amazónica,https://www.shutterstock.com/image-photo/tradicional-hammocks-on-amazon-society-600nw-1955912566.jpg
35,"amazon rainforest,  peru - sep, 2019: typical wooden cottage on the stilts in the small village in amazon rainforest. amazonia. south america.",https://www.shutterstock.com/image-photo/amazon-rainforest-peru-sep-2019-600nw-1964112142.jpg
36,"iquitos, peru- mar 28, 2018: house of  yagua tribe indian",https://www.shutterstock.com/image-photo/iquitos-peru-mar-28-2018-600nw-1112787983.jpg
37,destroyed tropical rainforest in amazonia. brazil flag with fire ash. pray for amazonia concept.,https://www.shutterstock.com/image-photo/destroyed-tropical-rainforest-amazonia-brazil-600nw-1521548810.jpg
38,una joven en una cucaracha yace en un campo con amapolas. ,https://www.shutterstock.com/image-photo/young-girl-roach-lies-field-600nw-2174726007.jpg
39,amazonas colombia. 23 de abril de 2010. los ticunas son un pueblo indígena que vive longitudinalmente entre perú y brasil entre el río putumayo y el río amazonas.,https://www.shutterstock.com/image-photo/amazonas-colombia-april-23-2010-600nw-2508098335.jpg
40,"vista exterior del mercado municipal adolpho lisboa en manaos. manaos, amazonas, brasil 19.09.2024",https://www.shutterstock.com/image-photo/exterior-view-adolpho-lisboa-municipal-600nw-2549886117.jpg
41,"detail of seringa rubber tree, cutted to drain latex, raw material for rubber.",https://www.shutterstock.com/image-photo/detail-seringa-rubber-tree-cutted-600nw-535306417.jpg
42,"amazonas colombia 20 de abril de 2010. el parque nacional natural amacayacu es una de las 56 áreas protegidas del sistema nacional de parques naturales de colombia, cerca del río amazonas.",https://www.shutterstock.com/image-photo/amazonas-colombia-april-20-2010-600nw-2508098687.jpg
43,"río amazonas colombia. 24 de abril de 2010. el río amazonas es un río sudamericano que atraviesa perú, colombia y brasil. es el río más largo y grande del mundo.",https://www.shutterstock.com/image-photo/amazon-river-colombia-april-24-600nw-2508098515.jpg
44,"semillas de annatto, onoto, annatto, bixa orellana, pigmento rojo natural",https://www.shutterstock.com/image-photo/annatto-seeds-onoto-bixa-orellana-600nw-1993322558.jpg
45,ishpingo or ecuadorian cinnamon tree flower cupule closeup,https://www.shutterstock.com/image-photo/ishpingo-ecuadorian-cinnamon-tree-flower-600nw-1035756265.jpg
46,the beauty of parrots,https://www.shutterstock.com/image-photo/beauty-parrots-600nw-1304887993.jpg
47,"atractivas mujeres de moda salvajes en la playa.
retrato de dos niñas indígenas tribales con 
con plumas en la cabeza afuera. ",https://www.shutterstock.com/image-photo/attractive-wild-fashion-boho-women-600nw-1665141955.jpg
48,"pinturas rupestres en cerro azul, san josé del guaviare, guaviare, colombia, sudamérica.",https://www.shutterstock.com/image-photo/rock-paintings-cerro-azul-san-600nw-2248310715.jpg
49,"salvador, bahia / brazil - may 29, 2017: pataxo ethnic woman seen during camp in salvador (ba) to discuss the political conjuncture and demand land demarcation (joa souza).",https://www.shutterstock.com/image-photo/salvador-bahia-brazil-may-29-600nw-1572322648.jpg
50,indian hut,https://www.shutterstock.com/image-photo/indian-hut-600nw-643545751.jpg
51,"paumari, brazil - dec 2019: portrait of children, a local inhabitants of the amazon rain forest. amazonia. latin america",https://www.shutterstock.com/image-photo/paumari-brazil-dec-2019-portrait-600nw-1870709116.jpg
52,foto de una líder tribal viéndose como un peligroso guerrero poderoso sobre fondo de niebla oscura,https://www.shutterstock.com/image-photo/photo-tribal-leader-lady-viking-600nw-2395123373.jpg
53,catfish in the ocean aquarium. fish from the ocean in the aquarium,https://www.shutterstock.com/image-photo/catfish-ocean-aquarium-fish-600nw-1063364996.jpg
54,"south america, chile, year 2009: indigenous chileans, children, high school students on the street, joyful",https://www.shutterstock.com/image-photo/south-america-chile-year-2009-600nw-572088001.jpg
55,indian woman hunter,https://www.shutterstock.com/image-photo/indian-woman-hunter-600nw-416161228.jpg
56,amazon rain forest in a perfect and lovely sunny day,https://www.shutterstock.com/image-photo/amazon-rain-forest-perfect-lovely-600nw-1577966857.jpg
57,"joven guerrera hermosa mujer vestida con ropa amazónica o guerrera medieval con ramo de flores en lugar de armas cerca del árbol de flores de cerezo en el jardín de primavera, paisaje pintoresco",https://www.shutterstock.com/image-photo/young-beautiful-warrior-girl-woman-600nw-2215965111.jpg
58,"río amazonas colombia. 24 de abril de 2010. el río amazonas es un río sudamericano que atraviesa perú, colombia y brasil. es el río más largo y grande del mundo.",https://www.shutterstock.com/image-photo/amazon-river-colombia-april-24-600nw-2508098505.jpg
59,"a green parrot sitting on the chain link fence, brazil",https://www.shutterstock.com/image-photo/green-parrot-sitting-on-chain-600nw-140473648.jpg
60,indian monkey wildlife,https://www.shutterstock.com/image-photo/indian-monkey-wildlife-600nw-1122281444.jpg
61,"foto de varios recuerdos en el mercado municipal adolfo lisboa en manaos. manaos, amazonas, brasil 19.09.2024",https://www.shutterstock.com/image-photo/photo-various-souvenirs-adolpho-lisboa-600nw-2549155083.jpg
62,"cuipari, perú; 1 de octubre de 2022: pescador trabajando en la selva peruana. lago cuipari.",https://www.shutterstock.com/image-photo/cuipari-peru-1st-october-2022-600nw-2324111187.jpg
63,loro de macao sobre fondo blanco.,https://www.shutterstock.com/image-photo/macaw-parrot-on-white-background-600nw-2417100761.jpg
64,brown discus (symphysodon aequifasciatus) fighting with turquoise discus for territories,https://www.shutterstock.com/image-photo/brown-discus-symphysodon-aequifasciatus-fighting-600nw-1396115762.jpg
65,"amazon basin, peru - december 4, 2018: a local boy stands on the stump in front of a wooden house on stilts in a small village in the amazon jungle in south america. amazon river basin.",https://www.shutterstock.com/image-photo/amazon-basin-peru-december-4-600nw-1775896595.jpg
66,natural of wild ,https://www.shutterstock.com/image-photo/natural-wild-600nw-1119837521.jpg
67,"
oenocarpus bacaba is an economically important monoecious fruiting palm native to the amazon rainforest, which has edible fruits. arecaceae family.
",https://www.shutterstock.com/image-photo/oenocarpus-bacaba-economically-important-monoecious-600nw-1037728291.jpg
68,"río amazonas, perú - 04 de diciembre de 2018:  barco lento en el puerto en un pequeño pueblo a orillas del río amazonas, amazonia, sudamérica.",https://www.shutterstock.com/image-photo/amazon-river-peru-december-04-600nw-2332227735.jpg
69,"iquitos, perú - 28 de marzo de 2018: hogar de la tribu india de yagua. amazonía. sudamérica.",https://www.shutterstock.com/image-photo/iquitos-peru-mar-28-2018-600nw-2358414199.jpg
70,el macao azul es un gran loro azul nativo de las selvas tropicales de sudamérica.,https://www.shutterstock.com/image-photo/blue-macaw-large-parrot-native-600nw-2252016327.jpg
71,"amazonia, peru - nov 10, 2010: unidentified amazonian indigenous smiling woman. indigenous people of amazonia are protected by coica (coordinator of indigenous organizations of the amazon river basin)",https://www.shutterstock.com/image-photo/amazonia-peru-nov-10-2010-600nw-188438279.jpg
72,cartel de madera de brasil (en portugués) con fondo forestal,https://www.shutterstock.com/image-photo/brazil-in-portuguese-wooden-sign-600nw-267405506.jpg
73,"jaguar is a cat, a feline in the panthera genus only extant panthera species native to the americas. jaguar is the third-largest feline after the tiger and lion, and the largest in the americas.",https://www.shutterstock.com/image-photo/jaguar-cat-feline-panthera-genus-600nw-1223152318.jpg
74,un campo de árboles de yuca o tubérculos leñosos,https://www.shutterstock.com/image-photo/field-cassava-trees-woody-tubers-600nw-1793069272.jpg
75,roadside hawk - rupornis magnirostris relatively small bird of prey found in the americas sitting on the stake next to the road. grey brown bird with yellow beak.,https://www.shutterstock.com/image-photo/roadside-hawk-rupornis-magnirostris-relatively-600nw-1330504259.jpg
76,"amazonas colombia 20 de abril de 2010. el parque nacional natural amacayacu es una de las 56 áreas protegidas del sistema nacional de parques naturales de colombia, cerca del río amazonas.",https://www.shutterstock.com/image-photo/amazonas-colombia-april-20-2010-600nw-2508098715.jpg
77,"jaguar is a cat, a feline in the panthera genus only extant panthera species native to the americas. jaguar is the third-largest feline after the tiger and lion, and the largest in the americas.",https://www.shutterstock.com/image-photo/jaguar-cat-feline-panthera-genus-600nw-1223152345.jpg
78,"11 de mayo de 2023 - italia - milán - inauguración de la exposición fotográfica ""amazonia"" del fotógrafo sebastiao salgado. las fotografías están expuestas en la ""fabbrica del vapore"".  ",https://www.shutterstock.com/image-photo/may-11-2023-italy-milan-600nw-2301694617.jpg
79,açaí bosque palma río amazonas manglar isla de marajó salvaterra biodiversidad fauna flora naturaleza ecoturismo paisaje rural comunidad vegetación indígena navegación costera barcos drone,https://www.shutterstock.com/image-photo/forest-palm-amazon-river-mangrove-600nw-2484128941.jpg
80,"isolated abalone fruit brazilian fruits named nuts from pará, typical in amazon rainforest and entire northern region of brazil ",https://www.shutterstock.com/image-photo/isolated-abalone-fruit-brazilian-fruits-600nw-1327711496.jpg
81,dugout canoe called peke peke in peruvian jungle,https://www.shutterstock.com/image-photo/dugout-canoe-called-peke-peruvian-600nw-414467218.jpg
82,"iquitos, peru 17.12.2012, south america, belen fish market in the iquitos (nauta, belem), major city in amazonia. selling turtles and their eggs to eat.",https://www.shutterstock.com/image-photo/iquitos-peru-17122012-south-america-600nw-1487374130.jpg
83,"javari river, the tributary of the amazon river, amazonia.selva on the border of brazil and peru. south america.",https://www.shutterstock.com/image-photo/javari-river-tributary-amazon-amazoniaselva-260nw-1127505881.jpg
84,"amazon river / peru - 10 may 2011: people in the boat in amazon river in peru, south america",https://www.shutterstock.com/image-photo/amazon-river-peru-10-may-600nw-1674957043.jpg
85,"macedonia, amazonia / colombia - mar 15 2016: local ticuna tribal member with bark from a tree to use it a textile like material",https://www.shutterstock.com/image-photo/macedonia-amazonia-colombia-mar-15-600nw-1160496841.jpg
86,"patrón turquesa rojo discute (pez pompadour) sobre fondo azul aislado. symphysodon aequifasciatus es un pez cíclico de agua dulce nativo del río amazonas, sudamérica. ",https://www.shutterstock.com/image-photo/red-turqouise-pattern-discus-pompadour-600nw-2390456025.jpg
87,"red and white discus (pompadour fish) in fish tank. symphysodon aequifasciatus is american cichlids native to the amazon river, south america,popular as freshwater aquarium fish.",https://www.shutterstock.com/image-photo/red-white-discus-pompadour-fish-600nw-698186431.jpg
88,modern tribal gypsy girl style,https://www.shutterstock.com/image-photo/modern-tribal-gypsy-girl-style-600nw-718247698.jpg
89,"hecale tiger longwing, also known as golden heliconian, native from mexico to the amazon rainforest.
",https://www.shutterstock.com/image-photo/hecale-tiger-longwing-known-golden-600nw-365563010.jpg
90,"un grupo de indios dessana se abrazan durante un ritual de bienvenida para los visitantes. ciudad de manaos, estado de amazonas, brasil 16 de octubre de 2024",https://www.shutterstock.com/image-photo/group-dessana-indians-embrace-each-600nw-2531487733.jpg
91,"rurrenabaque, bolivia, 12 de mayo de 2014: habitantes de la zona en un tradicional bote de madera en el río beni en la selva boliviana",https://www.shutterstock.com/image-photo/rurrenabaque-bolivia-may-12-2014-600nw-241159714.jpg
92,"retrato de marina silva, ministra de medio ambiente, aloízio mercadante, presidenta del bndes, y sonia guajajara, ministra de pueblos indígenas - río de janeiro, brasil 02.15.2023",https://www.shutterstock.com/image-photo/portrait-marina-silva-minister-environment-600nw-2333221995.jpg
93,niños amazónicos jugando en puente colgante ,https://www.shutterstock.com/image-photo/amazon-kids-playing-on-suspension-600nw-2382398329.jpg
94,"iquitos, peru 17.12.2012, south america, fish market in the iquitos (nauta, belen), major city in amazonia. selling fish to eat.",https://www.shutterstock.com/image-photo/iquitos-peru-17122012-south-america-600nw-1487377091.jpg
95,sunken old boats on the artificial moat surrounding the bayon tempe near angkor wat,https://www.shutterstock.com/image-photo/sunken-old-boats-on-artificial-600nw-1349319980.jpg
96,woman athlete in the amazon costume posing on a black background in the scenic red and blue light.,https://www.shutterstock.com/image-photo/woman-athlete-amazon-costume-posing-600nw-570374188.jpg
97,"discus (symphysodon), multi-colored cichlids in the aquarium",https://www.shutterstock.com/image-photo/discus-symphysodon-multicolored-cichlids-aquarium-600nw-736746166.jpg
98,"hyacinth macaw (anodorhynchus hyacinthinus), or hyacinthine macaw, is a blue parrot native south america's amazon jungle.",https://www.shutterstock.com/image-photo/hyacinth-macaw-anodorhynchus-hyacinthinus-hyacinthine-600nw-656895919.jpg
99,"santa cruz cabralia, bahia / brazil - april 21, 2009: pataxo indians are seen during disputes at indigenous games in the coroa vermelha village in the city of santa cruz cabralia.",https://www.shutterstock.com/image-photo/santa-cruz-cabralia-bahia-brazil-600nw-1860159319.jpg
