,Descripción,Link
0,"ecuador, orellana, napo river. bananas and flower, kichwa community of sani isla in the ecuadorean amazon (editorial usage only)",https://www.shutterstock.com/image-photo/ecuador-orellana-napo-river-bananas-600nw-1281336109.jpg
1,"¡atrevido, brillante y listo para deslumbrar! el macho del reloj de la roca andino hace una exhibición espectacular, haciendo alarde de su vibrante plumaje anaranjado en los exuberantes bosques del parque nacional del manu. perú",https://www.shutterstock.com/image-photo/bold-bright-ready-dazzle-andean-600nw-2535793665.jpg
2,"iquitos, perú - mayo del 2016: calle de pequeño pueblo tropical a orillas del río amazonas. amazonía. sudamérica.",https://www.shutterstock.com/image-photo/iquitos-peru-may-2016-street-600nw-2171349267.jpg
3,manifestación de una mujer indígena haciendo la tradicional chicha con yuca en la amazonía,https://www.shutterstock.com/image-photo/demonstration-indigenous-woman-making-traditional-600nw-2243612863.jpg
4,foto de la mujer líder tribal vikinga viste una joya tradicional para la magia ritual nocturna en bosques de miedo sobre fondo de niebla,https://www.shutterstock.com/image-photo/photo-viking-tribal-leader-lady-600nw-2523032479.jpg
5,"ecuador, yasuni national park - february 6, 2017: huaorani indian on the river in amazon jungle",https://www.shutterstock.com/image-photo/ecuador-yasuni-national-park-february-600nw-1317421472.jpg
6,"11 de mayo de 2023 - italia - milán - inauguración de la exposición fotográfica ""amazonia"" del fotógrafo sebastiao salgado. las fotografías están expuestas en la ""fabbrica del vapore"". ",https://www.shutterstock.com/image-photo/may-11-2023-italy-milan-600nw-2301693639.jpg
7,blue-fronted amazon parrot native to south america,https://www.shutterstock.com/image-photo/bluefronted-amazon-parrot-native-south-600nw-1580388079.jpg
8,"kulon progo, indonesia 11 de diciembre de 2022, retrato de una vieja pareja asiática en una aldea cerca de la ciudad de kulon",https://www.shutterstock.com/image-photo/kulon-progo-indonesia-december-11-600nw-2373061619.jpg
9,"la bella mujer que se levanta con vestido marrón y pone la cabeza en la cabeza con plumas de pájaros, fondo verde del bosque, retrato de maqueta posando, luz borrosa alrededor",https://www.shutterstock.com/image-photo/beautiful-woman-raising-wearing-brown-600nw-1660623007.jpg
10,"en la comunidad indígena de gamboa, amazonia, perú. ",https://www.shutterstock.com/image-photo/indigenous-community-gamboa-amazonia-peru-600nw-2118223409.jpg
11,"wooden boats on the sandy beach at the javari river, the tributary of the amazon river, during the low water season. amazonia. selva on the border of brazil and peru. south america. dos fronteras.",https://www.shutterstock.com/image-photo/wooden-boats-on-sandy-beach-260nw-1194372292.jpg
12,houses on stilts rise above the polluted water in islandia peru,https://www.shutterstock.com/image-photo/houses-on-stilts-rise-above-600nw-147761090.jpg
13,"a young amazon with a bow in the rainforest, book cover style",https://www.shutterstock.com/image-photo/young-amazon-bow-rainforest-book-600nw-367173452.jpg
14,"modern indian-style girl in a horned and feathered hat, dancing tribal and shamanic ritual dances. ",https://www.shutterstock.com/image-photo/modern-indianstyle-girl-horned-feathered-600nw-382546486.jpg
15,"iquitos, perú. 20 de septiembre de 2022: vistas de los barrios de chabolas y estilo de vida de la gente en el riverbank amazonas",https://www.shutterstock.com/image-photo/iquitos-peru-20th-september-2022-600nw-2208150387.jpg
16,"rio de janeiro, august 25, 2019:  manifestation in favor of the amazon rainforest and against the government of president jair bolsonaro at ipanema beach, rio de janeiro.",https://www.shutterstock.com/image-photo/rio-de-janeiro-august-25-600nw-1489194965.jpg
17,"close up of banisteriopsis caapi flowers and vine, one of the ayahuasca plants. psychadelic plant from brazil. used in indigenous rituals and shamanism. ",https://www.shutterstock.com/image-photo/close-banisteriopsis-caapi-flowers-vine-600nw-1493480918.jpg
18,"jaguar is a cat, a feline in the panthera genus only extant panthera species native to the americas. jaguar is the third-largest feline after the tiger and lion, and the largest in the americas.",https://www.shutterstock.com/image-photo/jaguar-cat-feline-panthera-genus-600nw-1341030182.jpg
19,"pterygoplichthys gibbiceps es una especie de bagre blindado nativo de brasil, ecuador, perú y venezuela donde se encuentra en las cuencas del orinoco y la amazonía",https://www.shutterstock.com/image-photo/pterygoplichthys-gibbiceps-s-species-armored-600nw-796090777.jpg
20,large blue river barge boat next to amazon village near ciavero lake,https://www.shutterstock.com/image-photo/large-blue-river-barge-boat-600nw-689026147.jpg
21,"lima, perú - 3 de diciembre de 2023: la artista amazónica wilma maynas de la comunidad amazónica shipibo konibo, en su casa de lima, perú",https://www.shutterstock.com/image-photo/lima-peru-dec-3-2023-600nw-2476631569.jpg
22,"indian river image, dam in india, choral dam ",https://www.shutterstock.com/image-photo/indian-river-image-dam-india-600nw-1345538678.jpg
23,"traditional, indian boat is building on the bank of the river in the amazon jungle",https://www.shutterstock.com/image-photo/traditional-indian-boat-building-on-600nw-1079396114.jpg
24,"cierre de los cocos de nueces crudas de brasil en una bolsa de neumático rústica en la selva amazónica. enfoque selectivo. medio ambiente, ecología, economía sostenible, conservación, biodiversidad, concepto de alimentos saludables.",https://www.shutterstock.com/image-photo/close-raw-fresh-brazil-nuts-600nw-1848095578.jpg
25,african style woman . attractive young woman in ethnic jewelry . close up portrait of a woman with a painted face. creative makeup and bright style.,https://www.shutterstock.com/image-photo/african-style-woman-attractive-young-600nw-651767161.jpg
26,crocodile on a white background.,https://www.shutterstock.com/image-photo/crocodile-on-white-background-600nw-707200129.jpg
27,"jangle, brazil - may 7, 2016: locals  leading  the small boat on the amazon river",https://www.shutterstock.com/image-photo/jangle-brazil-may-7-2016-600nw-507539791.jpg
28,"santa cruz cabralia, bahia / brazil - january 8, 2012: pataxo indians firing an arrow during the 11th edition of the indigenous games of coroa vermelha village, in southern bahia (joa souza). ",https://www.shutterstock.com/image-photo/santa-cruz-cabralia-bahia-brazil-600nw-1572732667.jpg
29,"santa cruz babralia, bahia / brazil  - april 15, 2008: indians of ethnic pataxos are spotted during indigenous games at the coroa vermelha village in the municipality of santa cruz cabralia.
",https://www.shutterstock.com/image-photo/santa-cruz-babralia-bahia-brazil-600nw-1604845822.jpg
30,overlooking a man-made jungle pond surrounded by vegetation at the california academy of sciences in san francisco,https://www.shutterstock.com/image-photo/overlooking-manmade-jungle-pond-surrounded-600nw-1361447546.jpg
31,"an example of bixa orellana fruit, with its seeds used to get natural red teinture",https://www.shutterstock.com/image-photo/example-bixa-orellana-fruit-seeds-600nw-521883895.jpg
32,woman athlete gymnast in the form of an elf performs acrobatics on a black background in the scenic red and blue light.,https://www.shutterstock.com/image-photo/woman-athlete-gymnast-form-elf-600nw-580952395.jpg
33,un disco rojo y blanco sobre fondo azul aislado. symphysodon es pescado de agua dulce en la familia de las cichlidae nativa de la cuenca del río amazonas en sudamérica.,https://www.shutterstock.com/image-photo/red-white-discus-on-isolated-600nw-2214852295.jpg
34,"""musa chiliocarpa back."" o ""plátano de mil dedos"" son pequeños plátanos. las flores aparecen al final de la planta. es un ramo de flores colgando. el plátano tiene una probóscide particularmente larga.",https://www.shutterstock.com/image-photo/musa-chiliocarpa-back-thousand-finger-600nw-2489432941.jpg
35,monkey,https://www.shutterstock.com/image-photo/monkey-600nw-498128083.jpg
36,"indígenas brasileños del grupo étnico pataxó celebran día internacional de los pueblos indígenas con canciones tradicionales y bailes con disfraces típicos - río de janeiro, brasil 08.12.2023",https://www.shutterstock.com/image-photo/brazilian-indigenous-men-ethnic-group-600nw-2352637301.jpg
37,woman athlete in the amazon costume posing on a black background in the scenic red and blue light.,https://www.shutterstock.com/image-photo/woman-athlete-amazon-costume-posing-600nw-570377530.jpg
38,"tortuga amazónica de manchas amarillas - podocnemis unifilis, tortuga de agua dulce única nativa de los ríos amazonas y orinoko en américa del sur, brasil.",https://www.shutterstock.com/image-photo/yellowspotted-amazon-turtle-podocnemis-unifilis-600nw-2510904473.jpg
39,"alalapadu, surinam - 16 de noviembre de 2016: un hombre indígena con sombrero verde mide un árbol talado para serrarlo en tablas en una aldea indígena tradicional en la selva amazónica",https://www.shutterstock.com/image-photo/alalapadu-suriname-november-16-2016-600nw-2476763455.jpg
40,tree full of fruits of the american genipa,https://www.shutterstock.com/image-photo/tree-full-fruits-american-genipa-600nw-1202839171.jpg
41,futurista mujer indígena tribal retrato con sombrero de cráneo de lobo al aire libre. bosque mágico azul en segundo plano,https://www.shutterstock.com/image-photo/futuristic-tribal-indian-woman-portrait-600nw-654521770.jpg
42,"tribal couple wearing traditional peruvian clothing and dancing anaconda dance, a musical genre typical of amazon region of peru",https://www.shutterstock.com/image-photo/tribal-couple-wearing-traditional-peruvian-600nw-1032141802.jpg
43,"la expresión extática del viejo chamán que realiza su ritual de dar la bienvenida a los visitantes a su tribu dessana. ciudad de manaos, estado de amazonas, brasil 26 de octubre de 2024",https://www.shutterstock.com/image-photo/ecstatic-expression-old-shaman-performing-600nw-2522468545.jpg
44,"manaus, amazon / brazil - august 06, 2011: dessana shaman talking about their culture at a dessana indigenous community on a river island near from manaus city.",https://www.shutterstock.com/image-photo/manaus-amazon-brazil-august-06-600nw-1048761863.jpg
45,"malay apple in a plastic bucket at belen market in iquitos, amazon peru",https://www.shutterstock.com/image-photo/malay-apple-plastic-bucket-belen-600nw-722258614.jpg
46,"selva amazónica, ecuador - 9 de octubre de 2022: indígena quechua montando una canoa al amanecer, selva amazónica, parque nacional yasuní, ecuador.",https://www.shutterstock.com/image-photo/amazon-rainforest-ecuador-october-9-600nw-2470432761.jpg
47,santa rosa peru - nov 2019: typical wooden cottage on the stilts in the small village in amazon rainforest. amazonia. south america.,https://www.shutterstock.com/image-photo/santa-rosa-peru-nov-2019-600nw-1871869228.jpg
48,"reserva de vida silvestre cuyabeno, ecuador - 24 de enero de 2023: carteles políticos en la orilla del río en la aldea siona de puerto bolívar en la reserva de vida silvestre cuyabeno, fuera del lago agrio",https://www.shutterstock.com/image-photo/cuyabeno-wildlife-reserve-ecuador-january-600nw-2514630395.jpg
49,"jaguar is a cat, a feline in the panthera genus only extant panthera species native to the americas. jaguar is the third-largest feline after the tiger and lion, and the largest in the americas.",https://www.shutterstock.com/image-photo/jaguar-cat-feline-panthera-genus-600nw-1344763883.jpg
50,"río amazonas, perú - mar 23, 2018: vista de la selva verde, en la orilla del río amazonas, infierno verde de la amazonía. selva en la frontera de brasil y perú. sudamérica.",https://www.shutterstock.com/image-photo/amazon-river-peru-mar-23-600nw-2472866369.jpg
51,"el curandero chamán del grupo étnico dessana posando para una foto después de sus curaciones con las bendiciones de los espíritus del bosque. ciudad de manaos, estado de amazonas, brasil, 11 de noviembre de 2024.",https://www.shutterstock.com/image-photo/shaman-healer-dessana-ethnic-group-600nw-2544033683.jpg
52,young beautiful tribal girl on the rocks,https://www.shutterstock.com/image-photo/young-beautiful-tribal-girl-on-600nw-400458214.jpg
53,woman jumping waterfall in indigenous village,https://www.shutterstock.com/image-photo/woman-jumping-waterfall-indigenous-village-600nw-1478111225.jpg
54,"perú. vista aérea de rio momon. top view of amazon rainforest, cerca de iquitos, perú. sudamérica. ",https://www.shutterstock.com/image-photo/peru-aerial-view-rio-momon-600nw-2160745237.jpg
55,"indian rose-ringed parrot, rose-ringed parakeet, true parrot, curved shape beak, indian green color parrot, on a tamarind tree branch, closeup",https://www.shutterstock.com/image-photo/indian-roseringed-parrot-parakeet-true-600nw-663085669.jpg
56,"amazonia, peru, december - 2017: water transport in the amazon rainforest, the green hell of the amazon. amazon river in the selva of peru. amazonia. south america.",https://www.shutterstock.com/image-photo/amazonia-peru-december-2017-water-600nw-2073131240.jpg
57,"hornbills bucerotidae, phuket province, thailand",https://www.shutterstock.com/image-photo/hornbills-bucerotidae-phuket-province-thailand-600nw-1023978964.jpg
58,mujer con traje tradicional indio occidental al fondo de manada de caballos en los rayos de la puesta de sol.,https://www.shutterstock.com/image-photo/woman-traditional-indian-western-dress-600nw-2136749757.jpg
59,la cocina más tradicional de los indígenas de la selva amazónica peruana (suri),https://www.shutterstock.com/image-photo/most-traditional-cuisine-indigenous-people-600nw-2442109717.jpg
60,"native houses along the amazon river in iquitos, peru.",https://www.shutterstock.com/image-photo/native-houses-along-amazon-river-600nw-573307654.jpg
61,"riga, letonia - 20 de agosto de 2023.  una mujer sobre una tabla de surf en un cuerpo de agua. ... ",https://www.shutterstock.com/image-photo/riga-latvia-august-20-2023-600nw-2388527303.jpg
62,"foto de un puesto en el mercado municipal adolfo lisboa, que ofrece varios tipos de granos a la venta. manaos, amazonas, brasil 19.09.2024",https://www.shutterstock.com/image-photo/photo-stall-mercado-municipal-adolpho-600nw-2548723857.jpg
63,"ilheus, bahia / brazil - january 7, 2009: indio tupinamba is seen in the village guarini taba ata in the city of ilheus.
",https://www.shutterstock.com/image-photo/ilheus-bahia-brazil-january-7-600nw-1698638206.jpg
64,"old carved wooden buildings belonging to tribes, covered with reed and abundant vegetation",https://www.shutterstock.com/image-photo/old-carved-wooden-buildings-belonging-600nw-729884749.jpg
65,"amazon, colombia - march, 2023: the people of colombia. indigineous village lifestyle scene, while a young child looking at the camera.",https://www.shutterstock.com/image-photo/amazon-colombia-march-2023-people-600nw-1492978940.jpg
66,"iquitos, peru 17.12.2012, south america, belen fish market in the iquitos (nauta, belem), major city in amazonia. selling turtles and their eggs to eat.",https://www.shutterstock.com/image-photo/iquitos-peru-17122012-south-america-600nw-1487374136.jpg
67,placemats hechos de fibra natural (palma de chambira) - artesanías tradicionales de los indígenas huaorani (huaorani) de la región amazónica de ecuador,https://www.shutterstock.com/image-photo/placemats-made-natural-fiber-chambira-600nw-2311094415.jpg
68,"jaguar cub is a big cat, a feline in the panthera genus only extant panthera species native to the americas. jaguar is the 3 largest feline after the tiger and lion, and the largest in the americas. ",https://www.shutterstock.com/image-photo/jaguar-cub-big-cat-feline-600nw-1112974649.jpg
69,"jungla, brasil - den 2, 2022: vista del atardecer de la laguna de coati cerca del río javari, el afluente del río amazonas, amazonia. selva en la frontera de brasil y perú. sudamérica.",https://www.shutterstock.com/image-photo/jungle-brazil-den-2-2022-600nw-2498695867.jpg
70,"manaus, brasil - 08-29-2023: retrato de indígenas amazónicos nativos con traje tradicional en el pueblo",https://www.shutterstock.com/image-photo/manaus-brazil-08292023-portrait-native-600nw-2368179391.jpg
71,amazon rain forest in a perfect and lovely sunny day,https://www.shutterstock.com/image-photo/amazon-rain-forest-perfect-lovely-600nw-728591938.jpg
72,guerrera india con arco ,https://www.shutterstock.com/image-photo/indian-woman-warrior-bow-600nw-271028699.jpg
73,"vista aérea de la selva amazónica en el alto río negro, en el estado de amazonas, en la frontera entre brasil y colombia, al noroeste del país.",https://www.shutterstock.com/image-photo/aerial-view-amazon-rainforest-upper-600nw-1931219615.jpg
74,"young woman native to the jungle of peru dancing. october 27, 2018 chanchamayo peru.",https://www.shutterstock.com/image-photo/young-woman-native-jungle-peru-600nw-1225454083.jpg
75,modern tribal gypsy girl style,https://www.shutterstock.com/image-photo/modern-tribal-gypsy-girl-style-600nw-718247473.jpg
76,"hyderabad, tg - india, septiembre de 2024: diferentes tipos de tribus indias del sur personas con vestidos tradicionales",https://www.shutterstock.com/image-photo/hyderabad-tg-india-september-2024-600nw-2516275135.jpg
77,woman athlete gymnast in the form of an elf performs acrobatics on a black background in the scenic red and blue light.,https://www.shutterstock.com/image-photo/woman-athlete-gymnast-form-elf-600nw-580953487.jpg
78,"rio de janeiro,(brazil),april,07,2020:
the ceasa rio de janeiro food bank donated food to indians confined by covid-19 in the beautiful green forest village in maricá coastal of rio de janeiro",https://www.shutterstock.com/image-photo/rio-de-janeirobrazilapril072020-ceasa-janeiro-600nw-1725248575.jpg
79,"semillas de annatto, onoto, annatto, bixa orellana, pigmento rojo natural",https://www.shutterstock.com/image-photo/annatto-seeds-onoto-bixa-orellana-600nw-2014609862.jpg
80,"porto seguro, bahia / brazil - february 26, 2010: pataxo indians are seen during land occupation on urubu island, in porto seguro (joa souza).",https://www.shutterstock.com/image-photo/porto-seguro-bahia-brazil-february-600nw-1572844546.jpg
81,"amazonia, peru - nov 10, 2010: unidentified amazonian indigenous boy portrait. indigenous people of amazonia are protected by  coica (coordinator of indigenous organizations of the amazon river basin)",https://www.shutterstock.com/image-photo/amazonia-peru-nov-10-2010-600nw-434574235.jpg
82,"isla de la fantasia, leticia, colombia - 8 dic. 2022: típicas cabañas de madera sobre pilotes en la isla de fantasy, en el pequeño pueblo de la selva amazónica. amazonía. sudamérica.",https://www.shutterstock.com/image-photo/isla-de-la-fantasia-leticia-600nw-2332249101.jpg
83,"tabatinga, brazil november 10 2017: an unidentified group of people at a traditional fruit market near the amazon river in a fish port in tabatinga, amazonia",https://www.shutterstock.com/image-photo/tabatinga-brazil-november-10-2017-600nw-757431031.jpg
84,"javari river, brazil - may 06, 2016: resident of the amazon jungle flows on a small boat",https://www.shutterstock.com/image-photo/javari-river-brazil-may-06-600nw-506664553.jpg
85,"blue and red discus (pompadour fish) are swimming in fish tank. symphysodon aequifasciatus is american cichlids native to the amazon river, south america,popular as freshwater aquarium fish.",https://www.shutterstock.com/image-photo/blue-red-discus-pompadour-fish-600nw-741367840.jpg
86,"reserva nacional pacaya samiria, perú - 14 de septiembre de 2024 vista de un naturalista junto a un árbol de caucho y sosteniendo una cuerda de látex.",https://www.shutterstock.com/image-photo/pacaya-samiria-national-reserve-peru-600nw-2529702419.jpg
87,adventure accommodation in south america: a traditional jungle house with palm roof and hammocks.,https://www.shutterstock.com/image-photo/adventure-accommodation-south-america-traditional-600nw-1076196506.jpg
88,beautiful girl archer with long blond hair with a bow and arrows dressed in leather and wristwear,https://www.shutterstock.com/image-photo/beautiful-girl-archer-long-blond-600nw-1476694811.jpg
89,"miembros de una delegación indígena de brasil participan en la marcha camina por su futuro clima antes de la cop27 en bruselas, bélgica el 23 de octubre de 2022.",https://www.shutterstock.com/image-photo/members-indigenous-delegation-brazil-take-600nw-2217598461.jpg
90,"discus (symphysodon), multi-colored cichlids in the aquarium",https://www.shutterstock.com/image-photo/discus-symphysodon-multicolored-cichlids-aquarium-600nw-736474789.jpg
91,"amazonia, peru - nov 10, 2010: unidentified amazonian indigenous . indigenous people of amazonia are protected by  coica (coordinator of indigenous organizations of the amazon river basin)",https://www.shutterstock.com/image-photo/amazonia-peru-nov-10-2010-600nw-434568439.jpg
92,discus fish in aquarium,https://www.shutterstock.com/image-photo/discus-fish-aquarium-600nw-1041634204.jpg
93,"cuipari, perú; 1 de octubre de 2022: pescador trabajando en la selva peruana. lago cuipari.",https://www.shutterstock.com/image-photo/cuipari-peru-1st-october-2022-600nw-2324111185.jpg
94,beautiful girl archer with long blond hair with a bow and arrowson a back holding two steel knifes cold arms,https://www.shutterstock.com/image-photo/beautiful-girl-archer-long-blond-600nw-1620898969.jpg
95,"siem reap, camboya - dec 13: compra cocodrilo siamés de cuero, 13 de diciembre de 2012 en siem reap, camboya. el cocodrilo siamés en casi todos los países está en peligro de extinción, el número total de aproximadamente 5000.",https://www.shutterstock.com/image-photo/siem-reap-cambodia-dec-13-600nw-156228026.jpg
96,discus fish in aquarium,https://www.shutterstock.com/image-photo/discus-fish-aquarium-600nw-1044761794.jpg
97,"amazonia, peru - nov 10, 2010: unidentified amazonian indigenous man smokes. indigenous people of amazonia are protected by coica (coordinator of indigenous organizations of the amazon river basin)",https://www.shutterstock.com/image-photo/amazonia-peru-nov-10-2010-600nw-188437478.jpg
98,"beautiful amazonian woman with indigenous facial paint and white traditional dress posing happily for camera in park environment, forest background",https://www.shutterstock.com/image-photo/beautiful-amazonian-woman-indigenous-facial-600nw-494966179.jpg
99,"london, united kingdom - september 5, 2020: extinction rebellion protesters wearing face masks in trafalgar square london united kingdom in respect of sos amazon and indigenous live matters",https://www.shutterstock.com/image-photo/london-united-kingdom-september-5-600nw-1809582205.jpg
