,Descripción,Link
0,"kwamalasamutu, surinam - 25 de noviembre de 2016: retrato de perfil de un hombre indígena con camiseta y gorra en la selva tropical.",https://www.shutterstock.com/image-photo/kwamalasamutu-suriname-november-25-2016-600nw-2483508535.jpg
1,"kwamalasamutu, surinam - 25 de noviembre de 2016: hombres y mujeres indígenas están haciendo piragüismo en un río en la selva tropical. el timonel está parado en la parte trasera del barco.",https://www.shutterstock.com/image-photo/kwamalasamutu-suriname-november-25-2016-600nw-2483575525.jpg
2,"kwamalasamutu, surinam - 25 de noviembre de 2016: un joven indígena con un gorro navega una canoa en un río en la selva tropical. al fondo, una segunda canoa con hombres es visible.",https://www.shutterstock.com/image-photo/kwamalasamutu-suriname-november-25-2016-600nw-2483585121.jpg
3,"kwamalasamutu, surinam - 25 de noviembre de 2016: un hombre indígena pesca de manera tradicional con una grande red de yeso en un río en la selva tropical.",https://www.shutterstock.com/image-photo/kwamalasamutu-suriname-november-25-2016-600nw-2483574521.jpg
4,"kwamalasamutu, surinam - 25 de noviembre de 2016: un hombre indígena camina junto a su canoa amarrada en una cascada en un río en la selva tropical. en su mano tiene gafas y una lanza para pescar.",https://www.shutterstock.com/image-photo/kwamalasamutu-suriname-november-25-2016-600nw-2483564993.jpg
5,"árboles caminantes en la selva amazónica, cuenca del río amazonas. valle de javari, amazonia. américa latina. el valle de javari es uno de los territorios indígenas más grandes. sudamérica",https://www.shutterstock.com/image-photo/walking-trees-amazon-rain-forest-600nw-2315491733.jpg
6,dron aéreo del río s doblar amazón,https://www.shutterstock.com/image-photo/aerial-drone-s-bend-amazon-600nw-1698020500.jpg
7,"hombre indígena del grupo étnico dessana o tukuya de pie con los brazos cruzados, fotografiado con troncos de árboles en el fondo. ciudad de manaos, brasil 3 de julio de 2024.",https://www.shutterstock.com/image-photo/indigenous-man-dessana-tukuya-ethnic-600nw-2484269585.jpg
8,"amazonia. latin america - nov 2018: portrait of a man on a small wooden boat, a local inhabitant of the amazon rain forest. javari valley. brazil",https://www.shutterstock.com/image-photo/amazonia-latin-america-nov-2018-600nw-1863945454.jpg
9,"el hermoso cabello negro de una mujer india de la selva amazónica. ciudad de manaus, estado de amazonas, brasil 3 de diciembre de 2021. ",https://www.shutterstock.com/image-photo/young-indian-dessana-tribe-painted-600nw-2085387892.jpg
10,"maloka museum bogotá colombia 20 de marzo de 2012. maloka es un museo interactivo sobre ciencia y tecnología. su nombre deriva de la maloca, un lugar utilizado por muchos grupos étnicos indígenas amazónicos.",https://www.shutterstock.com/image-photo/maloka-museum-bogota-colombia-20-600nw-2496663153.jpg
11,"cabaña rústica construida por una tribu nativa en lo profundo de la selva amazónica, mostrando la arquitectura tradicional y las prácticas de vida sostenible de las comunidades indígenas en su entorno natural",https://www.shutterstock.com/image-photo/rustic-hut-constructed-by-native-600nw-2480668845.jpg
12,"kwamalasamutu, surinam - 25 de noviembre de 2016: un hombre indígena muestra su captura de pescado, que capturó usando una lanza tradicional en un río en la selva tropical.",https://www.shutterstock.com/image-photo/kwamalasamutu-suriname-november-25-2016-600nw-2483586275.jpg
13,"maloka museum bogotá colombia 20 de marzo de 2012. maloka es un museo interactivo sobre ciencia y tecnología. su nombre deriva de la maloca, un lugar utilizado por muchos grupos étnicos indígenas amazónicos.",https://www.shutterstock.com/image-photo/maloka-museum-bogota-colombia-20-600nw-2496663159.jpg
14,"árboles caminantes en la selva amazónica, cuenca del río amazonas. valle de javari, amazonia. américa latina. el valle de javari es uno de los territorios indígenas más grandes. sudamérica",https://www.shutterstock.com/image-photo/walking-trees-amazon-rain-forest-600nw-2290528797.jpg
15,"kwamalasamutu, surinam - 26 de noviembre de 2016: retrato de un hombre, mujer y niño indígenas sentados en un banco contra la pared de una cabaña tradicional en la selva tropical.",https://www.shutterstock.com/image-photo/kwamalasamutu-suriname-november-26th-2016-600nw-2483516209.jpg
16,"iquitos, peru - dec 2019: portrait of  boy – an inhabitant of the peru. yagua tribe, nativa yagua comunidad. amazonia, latin america.",https://www.shutterstock.com/image-photo/iquitos-peru-dec-2019-portrait-600nw-2070560807.jpg
17,manos de mujer indígena de la tribu huitoto de la amazonía colombiana haciendo tejido tradicional de una canasta,https://www.shutterstock.com/image-photo/hands-indigenous-woman-huitoto-tribe-600nw-1864430785.jpg
18,"alalapadu, surinam - 16 de noviembre de 2016: en una aldea indígena de la selva amazónica surinamesa, una mujer y un niño indígenas se sientan al lado de un fuego de leña en el que se preparan alimentos en sartenes.",https://www.shutterstock.com/image-photo/alalapadu-suriname-november-16th-2016-600nw-2472425335.jpg
19,"kwamalasamutu, surinam - 25 de noviembre de 2016: un indígena con camiseta y gorra azul usa una liana para juntar un ramo de hojas de palma en un pueblo en la selva tropical.",https://www.shutterstock.com/image-photo/kwamalasamutu-suriname-november-25-2016-600nw-2483512473.jpg
20,"londres, reino unido, 22 de junio de 2024. la activista indígena nemonte nenquimo en la manifestación de protesta restore naturaleza now en londres, llamando a una acción política urgente sobre emergencias climáticas y naturales.",https://www.shutterstock.com/image-photo/london-uk-22nd-june-2024-600nw-2484827613.jpg
21,"kwamalasamutu, surinam - 24 de noviembre de 2016: una mujer indígena con un vestido azul se sienta y lava la ropa en cubos azules en un río en la selva tropical",https://www.shutterstock.com/image-photo/kwamalasamutu-suriname-november-24-2016-600nw-2483519245.jpg
22,"alalapadu, surinam - 16 de noviembre de 2016: tres niños indígenas vestidos de verde y azul juegan en el agua al borde de un arroyo en un pueblo indígena en la selva amazónica surinamesa",https://www.shutterstock.com/image-photo/alalapadu-suriname-november-16th-2016-600nw-2473601933.jpg
23,"alalapadu, surinam - 16 de noviembre de 2016: dos mujeres indígenas acompañadas por un niño lavan platos en un arroyo en un pueblo indígena en la selva amazónica surinamesa.",https://www.shutterstock.com/image-photo/alalapadu-suriname-november-16th-2016-600nw-2472825241.jpg
24,"hombres indígenas del grupo étnico tukuya o desana siendo fotografiados en su comunidad cerca de la ciudad de manaos. ciudad de manaos, brasil 23 de junio de 2023.",https://www.shutterstock.com/image-photo/indigenous-men-tukuya-desana-ethnic-600nw-2479627457.jpg
25,"hombre indígena del grupo étnico dessana o tukuya siendo fotografiado de perfil en su comunidad cerca de árboles y un arroyo. ciudad de manaus, brasil 23 de junio de 2023",https://www.shutterstock.com/image-photo/indigenous-man-dessana-tukuya-ethnic-600nw-2479630975.jpg
26,acercamiento de la mujer indígena brasileña a una tribu indígena en la amazonía,https://www.shutterstock.com/image-photo/closeup-face-native-brazilian-woman-600nw-642706297.jpg
27,casa de madera a orillas de un río en la amazonía.,https://www.shutterstock.com/image-photo/old-houseboat-made-wood-aluminum-600nw-2200895483.jpg
28,"hermosas hamacas coloridas en el barco de carga. amazonia, ruta de santa rosa a iquitos. río amazonas, perú.  sudamérica",https://www.shutterstock.com/image-photo/beautiful-colorful-hammocks-on-cargo-600nw-1747904786.jpg
29,"alalapadu, surinam - 16 de noviembre de 2016: un pequeño niño indígena con caña de pescar y mochila camina a través de un puente sobre un arroyo en una aldea indígena en la selva amazónica surinamesa ",https://www.shutterstock.com/image-photo/alalapadu-suriname-november-16th-2016-600nw-2472823181.jpg
30,"grupo de indígenas de la etnia dessana o tuyuka de perfil vistiendo sus trajes culturales típicos en su comunidad para presentar sus costumbres. ciudad de manaos, brasil, 15 de junio de 2024.",https://www.shutterstock.com/image-photo/group-indigenous-people-dessana-tuyuka-600nw-2475927551.jpg
31,"kwamalasamutu, surinam - 24 de noviembre de 2016: tres hombres indígenas navegan en canoa por un río en la selva tropical.",https://www.shutterstock.com/image-photo/kwamalasamutu-suriname-november-24-2016-600nw-2483572155.jpg
32,"trozo de árbol enorme en la selva amazónica, cuenca del río amazonas. valle de javari, amazonia. américa latina. el valle de javari es uno de los territorios indígenas más grandes. sudamérica",https://www.shutterstock.com/image-photo/trunk-huge-tree-amazon-rain-600nw-2315382223.jpg
33,mujer indígena de la tribu uitoto de la amazonia colombiana tejiendo una canasta tradicional,https://www.shutterstock.com/image-photo/indigenous-woman-uitoto-tribe-colombian-600nw-1864428289.jpg
34,"alalapadu, surinam - 17 de noviembre de 2016: un niño indígena con una toalla y botas wellington camina entre casas de madera tradicionales en un pueblo indígena en la selva amazónica surinamesa.",https://www.shutterstock.com/image-photo/alalapadu-suriname-november-17th-2016-600nw-2472813395.jpg
35,indígenas nukini y árbol sagrado en la selva amazónica en brasil,https://www.shutterstock.com/image-photo/nukini-indigenous-people-sacred-tree-600nw-2461943019.jpg
36,"kwamalasamutu, surinam - 23 de noviembre de 2016: una imagen de perfil del brazo y la cabeza bronceados de un hombre indígena con peinado mohawk y cola de caballo en la selva tropical",https://www.shutterstock.com/image-photo/kwamalasamutu-suriname-november-23-2016-600nw-2483508541.jpg
37,futurista mujer indígena tribal retrato con sombrero de cráneo de lobo al aire libre. bosque mágico azul en segundo plano,https://www.shutterstock.com/image-photo/futuristic-tribal-indian-woman-portrait-600nw-674029180.jpg
38,"kwamalasamutu, surinam - 24 de noviembre de 2016: una mujer indígena con el pelo largo y negro baña a su hijo mientras está sentada en un río en la selva tropical",https://www.shutterstock.com/image-photo/kwamalasamutu-suriname-november-24-2016-600nw-2483519247.jpg
39,"kwamalasamutu, surinam - 25 de noviembre de 2016: un hombre indígena muestra su pesca, que pescó en un río en la selva tropical.",https://www.shutterstock.com/image-photo/kwamalasamutu-suriname-november-25-2016-600nw-2483586273.jpg
40,"hombres de la tribu indígena tuyuka de la amazonía en su comunidad dando la bienvenida a los visitantes a sus tierras con ropa y símbolos de su cultura. ciudad de manaos, brasil 5 de junio de 2024",https://www.shutterstock.com/image-photo/men-amazonian-tuyuka-indigenous-tribe-600nw-2471739775.jpg
41,"los efectos en el cuerpo de una mujer india brasileña. ciudades de manaus, estado de amazonas, brasil 3 de diciembre de 2021 ",https://www.shutterstock.com/image-photo/young-indian-dessana-tribe-painted-600nw-2085383650.jpg
42,"dos mujeres indígenas de la etnia dessana o tukuna con sus trajes típicos sentadas en un banco de madera en su comunidad cerca de la ciudad de manaos. ciudad de manaos, brasil 15 de junio de 2024.",https://www.shutterstock.com/image-photo/two-indigenous-women-dessana-tukuna-600nw-2476133867.jpg
43,"una mujer indígena del grupo étnico dessana sentada en un banco de madera con adornos en su cuerpo. ciudad de manaos, brasil, 27 de junio de 2024.",https://www.shutterstock.com/image-photo/indigenous-woman-dessana-ethnic-group-600nw-2481789449.jpg
44,"kwamalasamutu, surinam - 25 de noviembre de 2016: una mujer indígena de mediana edad sonriente con una camisa azul brillante y un broche en un pueblo de la selva tropical.",https://www.shutterstock.com/image-photo/kwamalasamutu-suriname-november-25-2016-600nw-2483510071.jpg
45,"tres hombres indígenas de la etnia dessana o tukuya de pie con los brazos cruzados mientras eran fotografiados. ciudad de manaos, brasil 3 de julio de 2024.",https://www.shutterstock.com/image-photo/three-indigenous-men-dessana-tukuya-600nw-2484268739.jpg
46,"la joven indígena wayuri, vestida con su atuendo tradicional, mira directamente a la cámara mientras se apoya en un árbol en la selva amazónica ecuatoriana.",https://www.shutterstock.com/image-photo/young-wayuri-indigenous-girl-dressed-600nw-2477420769.jpg
47,"india brasileña con cara pintada. ciudad de manaus, estado de amazonas, brasil 3 de diciembre de 2021 ",https://www.shutterstock.com/image-photo/indigenous-tribe-woman-sitting-on-600nw-2085390418.jpg
48,"trozo de árbol enorme en la selva amazónica, cuenca del río amazonas. valle de javari, amazonia. américa latina. el valle de javari es uno de los territorios indígenas más grandes. sudamérica",https://www.shutterstock.com/image-photo/trunk-huge-tree-amazon-rain-600nw-2290528801.jpg
49,"alalapadu, surinam - 18 de noviembre de 2016: una profesora surinamesa con una sonrisa en la cara se para en una balaustrada de una escuela en un pueblo indígena en la selva amazónica.",https://www.shutterstock.com/image-photo/alalapadu-suriname-november-18-2016-600nw-2476781267.jpg
50,cabañas de jungla en la niebla de la madrugada,https://www.shutterstock.com/image-photo/jungle-huts-early-morning-fog-600nw-2033944136.jpg
51,"kwamalasamutu, surinam - 26 de noviembre de 2016: retrato de un hombre indígena usando un collar de cuentas tradicional hecho a mano con colgante sentado en una silla.",https://www.shutterstock.com/image-photo/kwamalasamutu-suriname-november-26th-2016-600nw-2483508537.jpg
52,"hombres indígenas del grupo étnico dessana sentados en un banco de madera en su comunidad. ciudad de manaos, brasil 20 de junio de 2024.",https://www.shutterstock.com/image-photo/indigenous-men-dessana-ethnic-group-600nw-2478466919.jpg
53,"hombres de la tribu indígena tuyuka de la amazonía en su comunidad dando la bienvenida a los visitantes a sus tierras con ropa y símbolos de su cultura. ciudad de manaos, brasil 5 de junio de 2024",https://www.shutterstock.com/image-photo/men-amazonian-tuyuka-indigenous-tribe-600nw-2471739779.jpg
54,"hombre indígena del grupo étnico dessana o tukuya de pie con los brazos cruzados, fotografiado con troncos de árboles en el fondo. ciudad de manaos, brasil 3 de julio de 2024.",https://www.shutterstock.com/image-photo/indigenous-man-dessana-tukuya-ethnic-600nw-2484269581.jpg
55,"vista aérea de la tierra indígena de koatinemo, zona demarcada donde vive el pueblo assurini, a orillas del río xingu, estado de pará. selva amazónica. la ciudad de altamira. bosque protegido",https://www.shutterstock.com/image-photo/aerial-view-indigenous-land-koatinemo-600nw-2434849063.jpg
56,"santa cruz cabralia, bahia , brazil - april 19, 2009: pataxo indians are seen during disputes at indigenous games in the coroa vermelha village in the city of santa cruz cabralia.",https://www.shutterstock.com/image-photo/santa-cruz-cabralia-bahia-brazil-600nw-1862610883.jpg
57,"típicos tejidos y collares de la tribu amazónica. iquitos, perú.",https://www.shutterstock.com/image-photo/traditional-amazonian-tribal-textile-patterns-600nw-548751481.jpg
58,"vista desde el barco de madera en la pared de la selva tropical verde de la selva amazónica, el infierno verde de la amazonía. selva en la frontera entre brasil y perú. amazonía. sudamérica.",https://www.shutterstock.com/image-photo/view-wooden-boat-on-wall-600nw-1852098154.jpg
59,una joven indígena de la amazonía con su ropa típica y su cara pintada. ciudad de manaos. brasil 12 de junio de 2024,https://www.shutterstock.com/image-photo/young-indigenous-woman-tuyuka-desana-600nw-2474878439.jpg
60,"girl from the jungle of peru. july 03, 2015 chanchamayo. peru.",https://www.shutterstock.com/image-photo/girl-jungle-peru-july-03-600nw-1311289268.jpg
61,"hombres indígenas del grupo étnico dessana sentados en un banco de madera en su comunidad. ciudad de manaos, brasil 20 de junio de 2024.",https://www.shutterstock.com/image-photo/indigenous-men-dessana-ethnic-group-600nw-2478466917.jpg
62,"tres hombres indígenas de la etnia dessana o tukuya de pie con los brazos cruzados mientras eran fotografiados. ciudad de manaos, brasil 3 de julio de 2024.",https://www.shutterstock.com/image-photo/three-indigenous-men-dessana-tukuya-600nw-2484268741.jpg
63,"alalapadu, surinam - 18 de noviembre de 2016: un hombre indígena con sombrero y un grande ramo de plátanos en la nuca camina a través de un claro en una aldea en la selva amazónica surinamesa",https://www.shutterstock.com/image-photo/alalapadu-suriname-november-18th-2016-600nw-2472010043.jpg
64,"dentro de la amazónica selva, rodeado de densa vegetación en el parque nacional cuyabeno, sudamérica ecuador",https://www.shutterstock.com/image-photo/inside-amazonian-jungle-surrounding-dense-600nw-662985616.jpg
65,una mujer indígena hornea un pan de mandioca de la manera tradicional en una grande bandeja redonda para hornear sobre una chimenea abierta. las llamas cocinan la harina en pan. un machete se usa como herramienta.,https://www.shutterstock.com/image-photo/indigenous-woman-bakes-cassava-bread-600nw-2472082475.jpg
66,"alalapadu, surinam - 18 de noviembre de 2016: vista de un salón de clases con unos cuantos académicos en un pueblo indígena en la selva amazónica. el profesor está sentado a una mesa y escribiendo algo.",https://www.shutterstock.com/image-photo/alalapadu-suriname-november-18-2016-600nw-2476781257.jpg
67,una grande bandeja redonda para hornear sobre un fuego abierto de leña con harina de yuca en una aldea indígena. las llamas cocinan la harina en pan de mandioca,https://www.shutterstock.com/image-photo/large-round-baking-tray-over-600nw-2472082479.jpg
68,vista aérea de la palma nativa buriti en medio de la selva amazónica. buritizal.,https://www.shutterstock.com/image-photo/aerial-view-native-buriti-palm-600nw-1982684321.jpg
69,"casa indígena tradicional hecha de paja y madera hogar de familias nativas de la comunidad en la selva tropical del amazonas en un soleado día de verano. concepto de ecología, medio ambiente, arquitectura.",https://www.shutterstock.com/image-photo/traditional-indigenous-house-made-straw-600nw-1929956567.jpg
70,los pies de las mujeres en el agua se desploman sintiendo frescura,https://www.shutterstock.com/image-photo/womens-feet-water-plunges-feeling-600nw-496846360.jpg
71,"hombre indígena del grupo étnico dessana o tukuya siendo fotografiado de perfil en su comunidad cerca de árboles y un arroyo. ciudad de manaus, brasil 23 de junio de 2023",https://www.shutterstock.com/image-photo/indigenous-man-dessana-tukuya-ethnic-600nw-2479630971.jpg
72,"alalapadu, surinam - 18 de noviembre de 2016: vista de un salón de clases con algunos escolares bromistas con uniforme escolar en una aldea indígena en la selva amazónica.",https://www.shutterstock.com/image-photo/alalapadu-suriname-november-18-2016-600nw-2476781259.jpg
73,"una mujer indígena brasileña con pintura facial tradicional explorando una densa selva, rodeada de exuberante vegetación.",https://www.shutterstock.com/image-photo/indigenous-brazilian-woman-traditional-face-600nw-2485307947.jpg
74,"hombre indígena del grupo étnico dessana o tukuya siendo fotografiado de perfil en su comunidad cerca de árboles y un arroyo. ciudad de manaus, brasil 23 de junio de 2023",https://www.shutterstock.com/image-photo/indigenous-man-dessana-tukuya-ethnic-600nw-2479630973.jpg
75,"alalapadu, surinam - 18 de noviembre de 2016: una niña sostiene en la mano un libro de texto titulado 'orientación sobre usted y el mundo' en un salón de clases en una aldea indígena en la selva amazónica. ",https://www.shutterstock.com/image-photo/alalapadu-suriname-november-18-2016-600nw-2476781263.jpg
76,"alalapadu, surinam - 18 de noviembre de 2016: un hombre indígena con un grande ramo de bananas en el cuello camina por un sendero en la selva amazónica surinamesa rodeado de vegetación silvestre",https://www.shutterstock.com/image-photo/alalapadu-suriname-november-18th-2016-600nw-2472010039.jpg
77,"un grupo de cinco hombres indígenas del grupo étnico desana o tukuya siendo fotografiados a orillas de un río en su comunidad. ciudad de manaus, brasil 20 de junio de 2024",https://www.shutterstock.com/image-photo/group-five-indigenous-men-desana-600nw-2478922609.jpg
78,"arte indígena quimbaya de colombia en la región cafetera, hecho a mano por ancestros de la cultura colombiana en la región cafetera de colombia",https://www.shutterstock.com/image-photo/quimbaya-indigenous-art-colombia-coffee-600nw-2463993301.jpg
79,"retrato de una mujer indígena brasileña con pintura facial tradicional, agachada en un exuberante entorno forestal.",https://www.shutterstock.com/image-photo/portrait-indigenous-brazilian-woman-traditional-600nw-2485307953.jpg
80,"canoas tradicionales de madera hechas por la tribu indígena wayuri, descansando a lo largo de las orillas del río puyo en la exuberante selva amazónica de ecuador.",https://www.shutterstock.com/image-photo/traditional-wooden-canoes-crafted-by-600nw-2480668833.jpg
81,"leticia, colombia - 11 de diciembre de 2022: la gente local vende bien en el bazar en el pequeño pueblo a orillas del río amazonas, amazonia. amazonas, américa latina",https://www.shutterstock.com/image-photo/leticia-colombia-dec-11-2022-600nw-2443049939.jpg
82,"leticia, amazonas, colombia - circa december 2019: boy in yellow shirt on top of the motorboat sailing on the river through amazon jungles on a sunny day.",https://www.shutterstock.com/image-photo/leticia-amazonas-colombia-circa-december-600nw-1737843263.jpg
83,"dos mujeres indígenas de la etnia dessana o tukuna con sus trajes típicos sentadas en un banco de madera en su comunidad cerca de la ciudad de manaos. ciudad de manaos, brasil 15 de junio de 2024.",https://www.shutterstock.com/image-photo/two-indigenous-women-dessana-tukuna-600nw-2476133865.jpg
84,"sao paulo, sp, brasil - 17 de marzo de 2024: altar para la ceremonia con bebida tradicional indígena ayawasca.",https://www.shutterstock.com/image-photo/sao-paulo-sp-brazil-march-600nw-2482681699.jpg
85,una joven indígena de la amazonía con su ropa típica y su cara pintada. ciudad de manaos. brasil 12 de junio de 2024,https://www.shutterstock.com/image-photo/young-indigenous-woman-tuyuka-desana-600nw-2474878363.jpg
86,"alalapadu, surinam - 16 de noviembre de 2016: la paz y la tranquilidad cuelgan en el aire entre casas de madera tradicionales en un pueblo indígena tradicional en la selva amazónica surinamesa. ",https://www.shutterstock.com/image-photo/alalapadu-suriname-november-16-2016-600nw-2472832425.jpg
87,"iquitos, peru - april 29: unidentified peruvian family in traditional boat floats on water street in belen, iquitos, peru on april 29, 2010. boats are only mode of transport in a poor area of iquitos.",https://www.shutterstock.com/image-photo/iquitos-peru-april-29-unidentified-600nw-486125983.jpg
88,"grupo de indígenas de la etnia dessana o tuyuka de perfil vistiendo sus trajes culturales típicos en su comunidad para presentar sus costumbres. ciudad de manaos, brasil, 15 de junio de 2024.",https://www.shutterstock.com/image-photo/group-indigenous-people-dessana-tuyuka-600nw-2475928087.jpg
89,"alalapadu, surinam - 18 de noviembre de 2016: una mujer indígena hornea un pan de mandioca de la manera tradicional en una grande bandeja redonda para hornear sobre un fuego de leña abierto. las llamas cocinan la harina en pan",https://www.shutterstock.com/image-photo/alalapadu-suriname-november-18th-2016-600nw-2472082481.jpg
90,arquitectura indígena tradicional en la selva amazónica peruana,https://www.shutterstock.com/image-photo/traditional-indigenous-architecture-peruvian-amazon-600nw-2484323513.jpg
91,"alalapadu, surinam - 18 de noviembre de 2016: una mujer indígena hornea un pan de mandioca de la manera tradicional en una grande bandeja redonda para hornear sobre un fuego de leña abierto. las llamas cocinan la harina en pan",https://www.shutterstock.com/image-photo/alalapadu-suriname-november-18th-2016-600nw-2472082477.jpg
92,"hombre indígena de la región amazónica del grupo étnico desana o tukuya siendo fotografiado a orillas de un río en la selva amazónica. ciudad de manaos, brasil 25 de junio de 2024.",https://www.shutterstock.com/image-photo/indigenous-man-amazon-region-desana-600nw-2480599529.jpg
93,"enormes árboles en la selva amazónica, cuenca del río amazonas. valle de javari, amazonia. américa latina. el valle de javari es uno de los territorios indígenas más grandes. sudamérica",https://www.shutterstock.com/image-photo/huge-trees-amazon-rain-forest-600nw-2290528787.jpg
94,"un grupo de cinco hombres indígenas del grupo étnico desana o tukuya siendo fotografiados a orillas de un río en su comunidad. ciudad de manaus, brasil 20 de junio de 2024",https://www.shutterstock.com/image-photo/group-five-indigenous-men-desana-600nw-2478922613.jpg
95,"kwamalasamutu, surinam - 24 de noviembre de 2016: un joven indígena con un gorro azul navega una canoa en un río en la selva tropical.",https://www.shutterstock.com/image-photo/kwamalasamutu-suriname-november-24-2016-600nw-2483585119.jpg
96,"alalapadu, surinam - 17 de noviembre de 2016: una niña con uniforme escolar juega bajo un grande barril de agua en una aldea indígena en la selva amazónica de surinam",https://www.shutterstock.com/image-photo/alalapadu-suriname-november-17th-2016-600nw-2472836369.jpg
97,"alalapadu, surinam - 17 de noviembre de 2016: una niña mira con cariño a dos loros verdes sentados en libertad en un palo cerca de un tablón con algo de mandioca en un pueblo indígena en la selva amazónica.",https://www.shutterstock.com/image-photo/alalapadu-suriname-november-17th-2016-600nw-2472817289.jpg
