,Descripción,Link
0,"niños de la etnia piaroa juegan en una canoa en las aguas del río autana, en el estado de amazonas, en el sur de venezuela
",https://www.shutterstock.com/image-photo/children-piaroa-ethnicity-play-on-600nw-364347374.jpg
1,"retrato al aire libre de india nativa americana, retrato de hembra chamánica con sombrero de pluma indio y maquillaje colorido",https://www.shutterstock.com/image-photo/native-american-indian-woman-portrait-600nw-1741280621.jpg
2,"retrato de una mujer bonita con un perro malamute de alaska en el bosque contra el fondo de la naturaleza",https://www.shutterstock.com/image-photo/portrait-pretty-woman-alaskan-malamute-600nw-1842752749.jpg
3,joven latino sentado en las rocas junto al río con sombrero en la mano,https://www.shutterstock.com/image-photo/lifestyle-young-latin-guy-sitting-600nw-2456548587.jpg
