,Descripción,Link
0,"joven guerrera hermosa mujer vestida con ropa amazónica o guerrera medieval con ramo de flores en lugar de armas cerca del árbol de flores de cerezo en el jardín de primavera, paisaje pintoresco",https://www.shutterstock.com/image-photo/young-beautiful-warrior-girl-woman-600nw-2248592219.jpg
1,joven latino sin camisa con sombrero y bolso en un árbol,https://www.shutterstock.com/image-photo/lifestyle-shirtless-young-latino-man-600nw-2455672049.jpg
2,cara del niño indígena matsiguenka de la amazona chupándose las manos,https://www.shutterstock.com/image-photo/face-matsiguenka-indigenous-child-amazon-600nw-2219197977.jpg
3,"joven guerrera hermosa mujer vestida con ropa amazónica o guerrera medieval con ramo de flores en lugar de armas cerca del árbol de flores de cerezo en el jardín de primavera, paisaje pintoresco",https://www.shutterstock.com/image-photo/young-beautiful-warrior-girl-woman-600nw-2202313733.jpg
4,"alalapadu, surinam - 16 de noviembre de 2016: en una aldea indígena de la selva amazónica surinamesa, una mujer y un niño indígenas se sientan al lado de un fuego de leña en el que se preparan alimentos en sartenes.",https://www.shutterstock.com/image-photo/alalapadu-suriname-november-16th-2016-600nw-2472425335.jpg
