,Descripción,Link
0,mujer indígena de la tribu uitoto de la amazonia colombiana tejiendo una canasta tradicional,https://www.shutterstock.com/image-photo/indigenous-woman-uitoto-tribe-colombian-600nw-1864428298.jpg
1,joven disfrazada de indio americano ,https://www.shutterstock.com/image-photo/young-woman-costume-american-indian-600nw-275261579.jpg
2,mujer indígena de la tribu huitoto de pie con canastas hechas a mano,https://www.shutterstock.com/image-photo/indigenous-woman-huitoto-tribe-standing-600nw-1864403677.jpg
3,"foto del jefe del grupo étnico dessana sosteniendo un tipo de flauta con un llamativo tocado en la cabeza. ciudad de manaos, estado de amazonas, brasil, 11 de noviembre de 2024.",https://www.shutterstock.com/image-photo/photo-chief-dessana-ethnic-group-600nw-2544057435.jpg
4,joven disfrazada de indio americano ,https://www.shutterstock.com/image-photo/young-woman-costume-american-indian-600nw-175740296.jpg
5,mujer hermosa con flor exótica,https://www.shutterstock.com/image-photo/beautiful-woman-exotic-flower-600nw-16213159.jpg
6,foto de la mujer líder tribal vikinga viste una joya tradicional para la magia ritual nocturna en bosques de miedo sobre fondo de niebla,https://www.shutterstock.com/image-photo/photo-viking-tribal-leader-lady-600nw-2523032479.jpg
7,"retrato de una joven encantadora mujer con un perro malamute de alaska en el bosque contra el fondo de la naturaleza",https://www.shutterstock.com/image-photo/portrait-young-charming-woman-alaskan-600nw-1851802063.jpg
8,"sambas, indonesia - 6 de agosto de 2024: carnaval de ropa tejida de sambas al que asistieron varios grupos, desde niños hasta adultos, llevando ropa única e interesante",https://www.shutterstock.com/image-photo/sambas-indonesia-august-6-2024-600nw-2498871921.jpg
