,Descripción,Link
0,mujer delgada disfrazada de amazon con una flecha y un arco en las manos,https://www.shutterstock.com/image-photo/slender-woman-amazon-costume-bow-600nw-1817877128.jpg
1,"
bella joven peruana de la cultura yanesha posando con vestidos, joyas, maquillaje, ropa y accesorios diseñados con iconografía asháninka en la naturaleza",https://www.shutterstock.com/image-photo/beautiful-young-peruvian-woman-yanesha-600nw-2335635769.jpg
2,mujer sexy y salvaje aislada de fondo blanco,https://www.shutterstock.com/image-photo/sexy-wild-woman-isolated-on-600nw-11178154.jpg
3,"cuatro mujeres de la etnia desana del amazonas sentadas en trajes típicos de su tribu siendo fotografiadas. ciudad de manaos, brasil 12 de junio de 2024.",https://www.shutterstock.com/image-photo/four-women-desana-ethnic-group-600nw-2474279037.jpg
4,retrato de cerca de una hermosa y sonriente joven morena con ropa y accesorios tribales de pie aislada sobre fondo negro,https://www.shutterstock.com/image-photo/close-portrait-beautiful-smiling-young-600nw-1484084531.jpg
5,retrato de niña turista asiática en la selva amazónica en el perú. la foto fue tomada en septiembre de 2024.,https://www.shutterstock.com/image-photo/asian-girl-tourist-portrait-amazon-600nw-2529035015.jpg
6,"una mujer indígena brasileña con pintura facial tradicional explorando una densa selva, rodeada de exuberante vegetación.",https://www.shutterstock.com/image-photo/indigenous-brazilian-woman-traditional-face-600nw-2485307947.jpg
7,"una mujer que vive en los bosques se comunica con su lobo en el bosque de otoño",https://www.shutterstock.com/image-photo/forest-dweller-woman-communicates-her-600nw-1838625046.jpg
