,Descripción,Link
0,"sambas, indonesia - 6 de agosto de 2024: carnaval de ropa tejida de sambas al que asistieron varios grupos, desde niños hasta adultos, llevando ropa única e interesante",https://www.shutterstock.com/image-photo/sambas-indonesia-august-6-2024-600nw-2498871923.jpg
1,"hombre indígena brasileño del grupo étnico pataxó retrato celebrando el día internacional de los pueblos indígenas con canciones tradicionales y bailes con disfraces típicos - río de janeiro, brasil 08.12.2023",https://www.shutterstock.com/image-photo/brazilian-indigenous-man-ethnic-group-600nw-2352637405.jpg
2,"mujer amazónica con cuatro trajes medievales con una lanza en la mano, con pintura de guerra.",https://www.shutterstock.com/image-photo/amazon-woman-fur-medieval-costume-600nw-2276209201.jpg
3,"tres hombres indígenas de la etnia dessana o tukuya de pie con los brazos cruzados mientras eran fotografiados. ciudad de manaos, brasil 3 de julio de 2024.",https://www.shutterstock.com/image-photo/three-indigenous-men-dessana-tukuya-600nw-2484268741.jpg
4,"jovencita de etnia con plumas en la cabeza aislada sobre fondo morado, hembra en la cima posando en cámara, el chamán sonríe",https://www.shutterstock.com/image-photo/young-ethnic-lady-feathers-on-600nw-1897169125.jpg
