,Descripción,Link
0,"mujer indígena del pueblo tuyuka de la amazonía en su comunidad con trajes típicos y pinturas en su rostro que demuestran sus costumbres culturales. ciudad de manaos, brasil 30 de mayo de 2024",https://www.shutterstock.com/image-photo/indigenous-woman-tuyuka-people-amazon-600nw-2469513675.jpg
1,mujer chamán en el paisaje invernal con su caballo.,https://www.shutterstock.com/image-photo/shaman-woman-winter-landscape-her-600nw-1991850089.jpg
2,joven disfrazada de indio americano ,https://www.shutterstock.com/image-photo/young-woman-costume-american-indian-600nw-275261573.jpg
3,joven disfrazada de indio americano ,https://www.shutterstock.com/image-photo/young-woman-costume-american-indian-600nw-175503158.jpg
4,"atractivas mujeres de moda salvajes en la playa.
retrato de dos niñas indígenas tribales con 
con plumas en la cabeza afuera. ",https://www.shutterstock.com/image-photo/attractive-wild-fashion-boho-women-600nw-1665141955.jpg
5,"aceh indonesia, 5 de mayo de 2024, un hombre sentado en una rama de madera ",https://www.shutterstock.com/image-photo/aceh-indonesia-5-mai-2024-600nw-2459109151.jpg
6,"bella mujer india en cucaracha, vestida con franjas y maquillaje en su cara, está echada en la hierba en el bosque",https://www.shutterstock.com/image-photo/beautiful-indian-woman-roach-dress-600nw-1790635247.jpg
7,"sao paulo, sp, brasil - 23 de abril de 2023: mujer indígena en la aldea amazónica brasileña con un colorido tocador de plumas.",https://www.shutterstock.com/image-photo/sao-paulo-sp-brazil-april-600nw-2347834305.jpg
