,Descripción,Link
0,"retrato de una bella y alegre joven morena con ropa y accesorios tribales de pie aislada sobre fondo negro, bailando",https://www.shutterstock.com/image-photo/portrait-beautiful-cheerful-young-brunette-600nw-1484084534.jpg
1,mujer sensual de la selva de la amazona. morena latina desnuda con piel oscura y pelo en el viento en posición sexy,https://www.shutterstock.com/image-photo/jungle-sensual-woman-amazon-nude-600nw-1044371455.jpg
2,"retrato emocional joven guerrera hermosa mujer en ropa amazónica o guerrero medieval con ramo de flores en lugar de armas cerca de cerezo árbol de flor en jardín de primavera, paisaje pintoresco",https://www.shutterstock.com/image-photo/emotional-portrait-young-beautiful-warrior-600nw-2444401281.jpg
3,mujer india al aire libre al atardecer. estilo nativo americano. fondo con espacio de texto libre,https://www.shutterstock.com/image-photo/indian-woman-outdoors-sunset-native-600nw-420044398.jpg
4,"la bella mujer vestida con vestido marrón y puso la cabeza con plumas de pájaros, fondo verde del bosque, retrato de maqueta posando, luz borrosa alrededor",https://www.shutterstock.com/image-photo/beautiful-woman-wearing-brown-dress-600nw-1660622173.jpg
5,retrato de un joven indio con sombrero en la mano al lado del río,https://www.shutterstock.com/image-photo/lifestyle-portrait-photo-young-indian-600nw-2456548597.jpg
