,Descripción,Link
0,"una mujer indígena brasileña con pintura facial tradicional explorando una densa selva, rodeada de exuberante vegetación.",https://www.shutterstock.com/image-photo/indigenous-brazilian-woman-traditional-face-600nw-2485307947.jpg
1,hombre espiritual superior en la naturaleza ,https://www.shutterstock.com/image-photo/spiritual-senior-man-nature-600nw-2465984123.jpg
2,"alalapadu, surinam - 16 de noviembre de 2016: un pequeño grupo de mujeres y niños indígenas caminan a través de una aldea indígena en la selva amazónica surinamesa hacia casas de madera tradicionales.",https://www.shutterstock.com/image-photo/alalapadu-suriname-november-16th-2016-600nw-2472834921.jpg
3,"escultura de una máscara chamán ""chamana"" en la comunidad indígena yagua, parque nacional amacayacu, amazon, colombia.",https://www.shutterstock.com/image-photo/sculpture-shaman-chamana-mask-yagua-600nw-2116422806.jpg
4,"alalapadu, surinam - 17 de noviembre de 2016: una mujer indígena y su hijo se relajan en una hamaca en un pueblo indígena en la selva amazónica surinamesa.",https://www.shutterstock.com/image-photo/alalapadu-suriname-november-17th-2016-600nw-2472811533.jpg
5,joven latino con un sombrero sentado en una roca junto al río y sonriendo,https://www.shutterstock.com/image-photo/lifestyle-young-latin-guy-wearing-600nw-2455672081.jpg
